{
  "$schema": "https://json-schema.org/draft/2020-12/schema",
  "$id": "https://geo-vault.local/schemas/country.schema.json",
  "title": "Country",
  "type": "object",
  "required": [
    "id",
    "name",
    "official_name",
    "slug",
    "iso2",
    "iso3",
    "numeric_code",
    "fips_code",
    "geoname_id",
    "continent_code",
    "continent",
    "region",
    "subregion",
    "capital",
    "area_sqkm",
    "population",
    "population_source",
    "currency_code",
    "currency_name",
    "phone_code",
    "tld",
    "languages",
    "neighbours",
    "lat",
    "lon",
    "wikidata_id"
  ],
  "additionalProperties": false,
  "properties": {
    "id": { "type": "string" },
    "name": { "type": "string" },
    "official_name": { "type": "string" },
    "slug": { "type": "string" },
    "iso2": { "type": "string" },
    "iso3": { "type": "string" },
    "numeric_code": { "type": "string" },
    "fips_code": { "type": "string" },
    "geoname_id": { "type": "string" },
    "continent_code": { "type": "string" },
    "continent": { "type": "string" },
    "region": { "type": "string" },
    "subregion": { "type": "string" },
    "capital": { "type": "string" },
    "area_sqkm": { "type": "string" },
    "population": { "type": "string" },
    "population_source": { "type": "string" },
    "currency_code": { "type": "string" },
    "currency_name": { "type": "string" },
    "phone_code": { "type": "string" },
    "tld": { "type": "string" },
    "languages": { "type": "array", "items": { "type": "string" } },
    "neighbours": { "type": "array", "items": { "type": "string" } },
    "lat": { "type": "string" },
    "lon": { "type": "string" },
    "wikidata_id": { "type": "string" }
  }
}
