{
  "id": "cn",
  "name": "China",
  "official_name": "People's Republic of China",
  "slug": "china",
  "iso2": "CN",
  "iso3": "CHN",
  "numeric_code": "156",
  "fips_code": "CH",
  "geoname_id": "1814991",
  "continent_code": "AS",
  "continent": "Asia",
  "region": "Asia",
  "subregion": "Eastern Asia",
  "capital": "Beijing",
  "area_sqkm": "9596960",
  "population": "1411778724",
  "population_source": "GeoNames countryInfo",
  "currency_code": "CNY",
  "currency_name": "Yuan Renminbi",
  "phone_code": "+86",
  "tld": ".cn",
  "languages": [
    "zh-CN",
    "yue",
    "wuu",
    "dta",
    "ug",
    "za"
  ],
  "neighbours": [
    "LA",
    "BT",
    "TJ",
    "KZ",
    "MN",
    "AF",
    "NP",
    "MM",
    "KG",
    "PK",
    "KP",
    "RU",
    "VN",
    "IN"
  ],
  "lat": "32.498178",
  "lon": "106.337289",
  "wikidata_id": "Q148"
}
