{
  "id": "bd",
  "name": "Bangladesh",
  "official_name": "People's Republic of Bangladesh",
  "slug": "bangladesh",
  "iso2": "BD",
  "iso3": "BGD",
  "numeric_code": "050",
  "fips_code": "BG",
  "geoname_id": "1210997",
  "continent_code": "AS",
  "continent": "Asia",
  "region": "Asia",
  "subregion": "Southern Asia",
  "capital": "Dhaka",
  "area_sqkm": "144000",
  "population": "161356039",
  "population_source": "GeoNames countryInfo",
  "currency_code": "BDT",
  "currency_name": "Taka",
  "phone_code": "+880",
  "tld": ".bd",
  "languages": [
    "bn-BD",
    "en"
  ],
  "neighbours": [
    "MM",
    "IN"
  ],
  "lat": "24.214956",
  "lon": "89.684963",
  "wikidata_id": "Q902"
}
